{
  "goal_type": "parity",
  "source_of_truth": "Curated fixture reference for parity validator test",
  "user_journeys": [
    {
      "name": "primary-journey",
      "description": "User completes the primary flow this fixture covers; substantive description for validator round-trip."
    }
  ],
  "completion_test": "The validator accepts this fixture as a valid ObjectiveContract instance for goal_type=parity."
}
